{
  "description": "Act 3 Chapter 8 entry: stabilizer corridor setup and handoff to normalization.",
  "name": "Act 3 Chapter 8 - Entry",
  "schema_version": 1,
  "version": 1,
  "entities": [
    {
      "behaviours": [
        "PlayerController",
        "Health",
        "Combat",
        "CameraFollow"
      ],
      "id": "act3_chapter8_entry_player_120_300_0_0",
      "name": "Player",
      "sprite": "assets/placeholder.png",
      "tag": "player",
      "x": 120,
      "y": 300
    },
    {
      "behaviours": [],
      "id": "act3_chapter8_entry_spawndefault_100_300_0_0",
      "name": "SpawnDefault",
      "sprite": "assets/placeholder.png",
      "tag": "spawn_point",
      "x": 100,
      "y": 300
    },
    {
      "behaviours": [
        "TriggerZone"
      ],
      "behaviour_config": {
        "TriggerZone": {
          "on_trigger": "act3_ch8_entry_briefing",
          "trigger_radius": 42.0,
          "trigger_target": "Player",
          "zone_id": "Act3Chapter8EntryBriefingZone"
        }
      },
      "id": "act3_chapter8_entry_briefingzone_280_300_0_0",
      "name": "Act3Chapter8EntryBriefingZone",
      "sprite": "assets/placeholder.png",
      "tag": "trigger",
      "x": 280,
      "y": 300
    },
    {
      "behaviours": [
        "SetGameStateOnEvent"
      ],
      "behaviour_config": {
        "SetGameStateOnEvent": {
          "event_type": "entered_zone",
          "payload_field": "zone",
          "payload_value": "Act3Chapter8EntryBriefingZone",
          "set_flags": {
            "act3_ch8_started": true
          },
          "forbid_flags": [
            "act3_ch8_started"
          ],
          "once": true,
          "toast": "Objective updated: Proceed to normalization.",
          "toast_seconds": 2.0
        }
      },
      "id": "act3_chapter8_entry_startedstatesync_m1000_m1000_0_0",
      "name": "Act3Ch8StartedStateSync",
      "sprite": "assets/placeholder.png",
      "tag": "system",
      "x": -1000.0,
      "y": -1000.0
    },
    {
      "behaviours": [
        "SceneTransition"
      ],
      "behaviour_config": {
        "SceneTransition": {
          "spawn_point": "SpawnDefault",
          "target_scene": "packs/core_regions/scenes/Act3_Chapter8_Normalize.json"
        }
      },
      "id": "act3_chapter8_entry_tonormalize_940_300_0_0",
      "name": "ToAct3Chapter8Normalize",
      "require_flags": [
        "act3_ch8_started"
      ],
      "sprite": "assets/placeholder.png",
      "tag": "door",
      "x": 940,
      "y": 300
    },
    {
      "behaviours": [
        "SceneTransition"
      ],
      "behaviour_config": {
        "SceneTransition": {
          "spawn_point": "SpawnDefault",
          "target_scene": "packs/core_regions/scenes/Act3_Chapter7_Exit.json"
        }
      },
      "id": "act3_chapter8_entry_returntoact3chapter7exit_60_300_0_0",
      "name": "ReturnToAct3Chapter7Exit",
      "sprite": "assets/placeholder.png",
      "tag": "door",
      "x": 60,
      "y": 300
    },
    {
      "behaviours": [
        "SetGameStateOnEvent"
      ],
      "behaviour_config": {
        "SetGameStateOnEvent": {
          "event_type": "scene_loaded",
          "set_flags": {
            "act3_ch8_started": true
          },
          "require_flags": [
            "act3_ch8_started"
          ],
          "once": false
        }
      },
      "id": "act3_chapter8_entry_startedrecheckstatesync_m1000_m1000_0_0",
      "name": "Act3Ch8StartedRecheckStateSync",
      "sprite": "assets/placeholder.png",
      "tag": "system",
      "x": -1000.0,
      "y": -1000.0
    }
  ]
}
